{
  "contractId": "P-003",
  "contractVersion": "1.0.0",
  "cueId": "cue:introduction:001",
  "cueDigest": "0123456789abcdef0123456789abcdef0123456789abcdef0123456789abcdef",
  "idempotencyKey": "idem:cue:introduction:001",
  "sessionId": "session:assurance:001",
  "sessionRevision": 3,
  "surfaceSlot": "audience-display",
  "registrationId": "registration:audience:001",
  "registrationRevision": 1,
  "connectionGeneration": 1,
  "semanticView": "pres-intro",
  "viewVersion": "1.0.0",
  "context": {
    "heading": "A governed source, not a magic answer",
    "message": "Harbour Community Support is reviewing synthetic policy material through accountable components and human authority.",
    "syntheticReference": "welcome-record"
  },
  "issuedAt": "2026-08-27T12:05:00Z",
  "expiresAt": "2026-08-27T12:06:00Z",
  "stageId": "scenario-introduction",
  "stepId": "show-introduction"
}
